{
  "receipt_id": "rcpt-B-0002",
  "created_at": "2026-05-02T09:12:30Z",
  "producer": {
    "id": "did:example:agent-operator-1",
    "revenue_relationships_disclosed": []
  },
  "binding": {
    "agent_credential_ref": "did:example:agent-7#key-1",
    "mandate_hash": "sha256:77d0…a4",
    "order_hash": "sha256:c2e9…5b"
  },
  "search_scope": {
    "merchants": [
      "outdoor-1",
      "outdoor-2"
    ],
    "query": "2 person tent",
    "searched_at": "2026-05-02T09:10:00Z",
    "response_hashes": [
      "sha256:d4b2…6e",
      "sha256:0f9c…a8"
    ]
  },
  "consideration_set": [
    {
      "id": "ridge-2",
      "price_usd": 180,
      "delivery_by": "2026-05-09",
      "stage": "selected"
    },
    {
      "id": "lite-2",
      "price_usd": 150,
      "delivery_by": "2026-05-16",
      "stage": "filtered"
    },
    {
      "id": "dome-2",
      "price_usd": 210,
      "delivery_by": "2026-05-08",
      "stage": "filtered"
    }
  ],
  "instruction_context": {
    "conversation_hash": "sha256:77e0…5b",
    "disclosable_excerpts": []
  },
  "constraints_applied": [
    {
      "constraint": "price_usd < 200",
      "source": "mandate",
      "pass": [
        "ridge-2",
        "lite-2"
      ],
      "fail": [
        "dome-2"
      ]
    },
    {
      "constraint": "delivery_by <= 2026-05-10",
      "source": "mandate",
      "pass": [
        "ridge-2",
        "dome-2"
      ],
      "fail": [
        "lite-2"
      ]
    }
  ],
  "criteria": [
    {
      "criterion": "lowest price among compliant options",
      "source": "stated",
      "weight": "primary"
    }
  ],
  "selected_option": {
    "id": "ridge-2",
    "main_reason": "only option meeting price and delivery constraints"
  },
  "rejected_alternatives": [
    {
      "id": "lite-2",
      "reason": "fails delivery constraint"
    },
    {
      "id": "dome-2",
      "reason": "fails price constraint"
    }
  ],
  "commercial_relationships": [],
  "verification_paths": [
    {
      "path": "price_comparison_service",
      "result": "no cheaper compliant option found",
      "independence": "different source"
    }
  ],
  "flags": [],
  "evidence_tier": "standard",
  "disclosure_map": {
    "issuer": [
      "*"
    ],
    "merchant": [
      "binding",
      "selected_option",
      "constraints_applied",
      "rejected_alternatives"
    ],
    "consumer": [
      "*"
    ]
  },
  "signature": {
    "alg": "EdDSA (Ed25519)",
    "value": "<signature over canonical JSON of all fields above>"
  }
}
